{
  "schema_version": "tn-agent.backend-result.v1",
  "request_digest": "sha256:e8a0eed66378a47b078a99227b308775c34312b561efbb0988fd6e8beff4c064",
  "binding": {
    "schema_version": "tn-agent.backend-binding.v1",
    "capability_id": "tenpy.infinite_1d.vumps",
    "adapter_id": "tenpy.v1",
    "backend_id": "tenpy",
    "request_schema": "tn-agent.tenpy.infinite-xxz-vumps.v1",
    "result_schema": "tn-agent.backend-result.v1"
  },
  "backend": {
    "schema_version": "tn-agent.backend-identity.v1",
    "backend_id": "tenpy",
    "backend_version": "1.1.0",
    "adapter_id": "tenpy.v1",
    "adapter_version": "1.0.0"
  },
  "environment": {
    "schema_version": "tn-agent.environment-identity.v1",
    "environment_digest": "sha256:33f97f66d496d52d7a68f6a05160f07f90b1d928cea8481f892db7dac132a756",
    "runtime_id": "python",
    "runtime_version": "3.12.4",
    "dependencies": {
      "numpy": "2.0.1",
      "tenpy": "1.1.0"
    }
  },
  "execution": {
    "schema_version": "tn-agent.execution-evidence.v1",
    "status": "succeeded",
    "return_code": 0,
    "execution_handle": "fixture:infinite:primary",
    "retryable": false,
    "stdout_digest": "sha256:ba5226f2581a284e5171d6f235c08eeb537709c4dbcb0c3a90b4530a7dd633a1",
    "stderr_digest": "sha256:76dcbfe7624517874bbf3765410e2f588877eb80ad42e92a823d2c21d3c94add",
    "stdout_truncated": false,
    "stderr_truncated": false
  },
  "observables": {
    "central_charge_fit": {
      "schema_version": "tn-agent.observable-evidence.v1",
      "name": "central_charge_fit",
      "status": "derived",
      "value": 0.501,
      "units": "dimensionless",
      "normalization": "fit",
      "reason": null
    },
    "energy": {
      "schema_version": "tn-agent.observable-evidence.v1",
      "name": "energy",
      "status": "measured",
      "value": -0.4431,
      "units": "J",
      "normalization": "per-site",
      "reason": null
    },
    "entanglement_entropy": {
      "schema_version": "tn-agent.observable-evidence.v1",
      "name": "entanglement_entropy",
      "status": "measured",
      "value": [
        0.612,
        0.731
      ],
      "units": "dimensionless",
      "normalization": "bond",
      "reason": null
    },
    "transfer_spectrum": {
      "schema_version": "tn-agent.observable-evidence.v1",
      "name": "transfer_spectrum",
      "status": "measured",
      "value": [
        1.0,
        0.721,
        0.519,
        0.374
      ],
      "units": "dimensionless",
      "normalization": "spectrum",
      "reason": null
    },
    "variance": {
      "schema_version": "tn-agent.observable-evidence.v1",
      "name": "variance",
      "status": "backend_limited",
      "value": null,
      "units": "J^2",
      "normalization": "per-site",
      "reason": "TeNPy 1.1.0 does not expose UniformMPS energy variance"
    }
  },
  "convergence": [
    {
      "schema_version": "tn-agent.convergence-point.v1",
      "step": 1,
      "metrics": {
        "energy": -0.443
      }
    },
    {
      "schema_version": "tn-agent.convergence-point.v1",
      "step": 2,
      "metrics": {
        "energy": -0.4431,
        "canonical_residual": 0.001,
        "symmetry_residual": 1e-10
      }
    }
  ],
  "diagnostics": [],
  "provenance": {
    "schema_version": "tn-agent.provenance-evidence.v1",
    "plan_id": "sha256:583e130a0daa654eeecfe215f84196d37cb1792480d811dfc42f11b1cb25df60",
    "capability_id": "tenpy.infinite_1d.vumps",
    "adapter_id": "tenpy.v1",
    "raw_result_relative": "backend-raw-result.json"
  },
  "artifacts": [
    {
      "schema_version": "tn-agent.result-artifact.v1",
      "relative_path": "backend-raw-result.json",
      "digest": "sha256:ef892045230c418b022ab3e43b33e2b4046ed9790aca62bb3161675e2ecbc38c",
      "media_type": "application/json",
      "size_bytes": 2260
    }
  ],
  "warnings": [
    "variance is backend-limited on the infinite route"
  ],
  "known_limitations": [
    "TeNPy UniformMPS is experimental.",
    "Energy variance is backend-limited on this route.",
    "The fixture does not count as a generated challenge problem."
  ],
  "backend_limited_fields": [
    "variance"
  ],
  "result_digest": "sha256:7f710c61dc85c250b0d77d5a98ebb1a51194ccbd18cb80df89be885392a9437e"
}
